{
  "bundle_id": "forge-policy-bundle:production-1.0.0",
  "version": "1.0.0",
  "created_at": "2026-07-25T20:00:00Z",
  "created_by": "forge-architect:primary",
  "status": "candidate",
  "parent_bundle_id": null,
  "policies": [
    {
      "policy_id": "forge-policy:user-directed-print-start",
      "version": "1.0.0",
      "digest": "sha256:9d9a8f7d8d6515714f8744d4ec5701a6dcfb8031e204c77362f10d3265113f46"
    }
  ],
  "constitution": {
    "reference": "forge-constitution:1",
    "digest": "sha256:aaaaaaaaaaaaaaaaaaaaaaaaaaaaaaaaaaaaaaaaaaaaaaaaaaaaaaaaaaaaaaaa",
    "verified": true
  },
  "sentinel": {
    "reference": "forge-sentinel-review:production-1.0.0",
    "digest": "sha256:bbbbbbbbbbbbbbbbbbbbbbbbbbbbbbbbbbbbbbbbbbbbbbbbbbbbbbbbbbbbbbbb",
    "verified": true
  },
  "rollout": {
    "channels": ["development", "canary", "production"],
    "minimum_percent": 1,
    "maximum_percent": 100,
    "required_approvals": [
      {
        "approval_type": "forge.approval.architect",
        "minimum_count": 1
      },
      {
        "approval_type": "forge.approval.ai_council",
        "minimum_count": 1
      }
    ]
  },
  "content_digest": "sha256:c6c812e286630a13f67fef4ed81fed3cb83a3ba2e47a93997da77bd13df6e3b4",
  "signatures": [
    {
      "key_id": "forge-key:release-2026-01",
      "algorithm": "ed25519",
      "signature": "c2lnbmF0dXJlLXBsYWNlaG9sZGVy",
      "verified": true
    }
  ]
}
